[
  {
    "id": "jee-main-physics-rotational-motion-01",
    "exam": "JEE Main",
    "subject": "Physics",
    "chapter": "Rotational Motion",
    "subtopic": "Centre of mass of a two-particle system",
    "subtopic_segmentation": "derived_by_contributor",
    "prerequisite_concepts": [],
    "in_syllabus": true,
    "source_url": "https://cdnbbsr.s3waas.gov.in/s3f8e59f4b2fe7c5705bf878bbd494ccdf/uploads/2025/10/202510311323551056.pdf",
    "source_landing_page": "https://jeemain.nta.nic.in/document/syllabus-2026/",
    "source_publisher": "National Testing Agency (NTA), Ministry of Education, Government of India",
    "source_last_updated": "2026-07-14",
    "verification_date": "2026-09-18",
    "verification_status": "verified"
  },
  {
    "id": "jee-main-physics-rotational-motion-02",
    "exam": "JEE Main",
    "subject": "Physics",
    "chapter": "Rotational Motion",
    "subtopic": "Centre of mass of a rigid body",
    "subtopic_segmentation": "derived_by_contributor",
    "prerequisite_concepts": [],
    "in_syllabus": true,
    "source_url": "https://cdnbbsr.s3waas.gov.in/s3f8e59f4b2fe7c5705bf878bbd494ccdf/uploads/2025/10/202510311323551056.pdf",
    "source_landing_page": "https://jeemain.nta.nic.in/document/syllabus-2026/",
    "source_publisher": "National Testing Agency (NTA), Ministry of Education, Government of India",
    "source_last_updated": "2026-07-14",
    "verification_date": "2026-09-18",
    "verification_status": "verified"
  },
  {
    "id": "jee-main-physics-rotational-motion-03",
    "exam": "JEE Main",
    "subject": "Physics",
    "chapter": "Rotational Motion",
    "subtopic": "Basic concepts of rotational motion",
    "subtopic_segmentation": "derived_by_contributor",
    "prerequisite_concepts": [],
    "in_syllabus": true,
    "source_url": "https://cdnbbsr.s3waas.gov.in/s3f8e59f4b2fe7c5705bf878bbd494ccdf/uploads/2025/10/202510311323551056.pdf",
    "source_landing_page": "https://jeemain.nta.nic.in/document/syllabus-2026/",
    "source_publisher": "National Testing Agency (NTA), Ministry of Education, Government of India",
    "source_last_updated": "2026-07-14",
    "verification_date": "2026-09-18",
    "verification_status": "verified"
  },
  {
    "id": "jee-main-physics-rotational-motion-04",
    "exam": "JEE Main",
    "subject": "Physics",
    "chapter": "Rotational Motion",
    "subtopic": "Moment of a force",
    "subtopic_segmentation": "derived_by_contributor",
    "prerequisite_concepts": [],
    "in_syllabus": true,
    "source_url": "https://cdnbbsr.s3waas.gov.in/s3f8e59f4b2fe7c5705bf878bbd494ccdf/uploads/2025/10/202510311323551056.pdf",
    "source_landing_page": "https://jeemain.nta.nic.in/document/syllabus-2026/",
    "source_publisher": "National Testing Agency (NTA), Ministry of Education, Government of India",
    "source_last_updated": "2026-07-14",
    "verification_date": "2026-09-18",
    "verification_status": "verified"
  },
  {
    "id": "jee-main-physics-rotational-motion-05",
    "exam": "JEE Main",
    "subject": "Physics",
    "chapter": "Rotational Motion",
    "subtopic": "Torque",
    "subtopic_segmentation": "derived_by_contributor",
    "prerequisite_concepts": ["Moment of a force"],
    "in_syllabus": true,
    "source_url": "https://cdnbbsr.s3waas.gov.in/s3f8e59f4b2fe7c5705bf878bbd494ccdf/uploads/2025/10/202510311323551056.pdf",
    "source_landing_page": "https://jeemain.nta.nic.in/document/syllabus-2026/",
    "source_publisher": "National Testing Agency (NTA), Ministry of Education, Government of India",
    "source_last_updated": "2026-07-14",
    "verification_date": "2026-09-18",
    "verification_status": "verified"
  },
  {
    "id": "jee-main-physics-rotational-motion-06",
    "exam": "JEE Main",
    "subject": "Physics",
    "chapter": "Rotational Motion",
    "subtopic": "Angular momentum",
    "subtopic_segmentation": "derived_by_contributor",
    "prerequisite_concepts": ["Torque"],
    "in_syllabus": true,
    "source_url": "https://cdnbbsr.s3waas.gov.in/s3f8e59f4b2fe7c5705bf878bbd494ccdf/uploads/2025/10/202510311323551056.pdf",
    "source_landing_page": "https://jeemain.nta.nic.in/document/syllabus-2026/",
    "source_publisher": "National Testing Agency (NTA), Ministry of Education, Government of India",
    "source_last_updated": "2026-07-14",
    "verification_date": "2026-09-18",
    "verification_status": "verified"
  },
  {
    "id": "jee-main-physics-rotational-motion-07",
    "exam": "JEE Main",
    "subject": "Physics",
    "chapter": "Rotational Motion",
    "subtopic": "Conservation of angular momentum and its applications",
    "subtopic_segmentation": "derived_by_contributor",
    "prerequisite_concepts": ["Angular momentum"],
    "in_syllabus": true,
    "source_url": "https://cdnbbsr.s3waas.gov.in/s3f8e59f4b2fe7c5705bf878bbd494ccdf/uploads/2025/10/202510311323551056.pdf",
    "source_landing_page": "https://jeemain.nta.nic.in/document/syllabus-2026/",
    "source_publisher": "National Testing Agency (NTA), Ministry of Education, Government of India",
    "source_last_updated": "2026-07-14",
    "verification_date": "2026-09-18",
    "verification_status": "verified"
  },
  {
    "id": "jee-main-physics-rotational-motion-08",
    "exam": "JEE Main",
    "subject": "Physics",
    "chapter": "Rotational Motion",
    "subtopic": "Moment of inertia",
    "subtopic_segmentation": "derived_by_contributor",
    "prerequisite_concepts": [],
    "in_syllabus": true,
    "source_url": "https://cdnbbsr.s3waas.gov.in/s3f8e59f4b2fe7c5705bf878bbd494ccdf/uploads/2025/10/202510311323551056.pdf",
    "source_landing_page": "https://jeemain.nta.nic.in/document/syllabus-2026/",
    "source_publisher": "National Testing Agency (NTA), Ministry of Education, Government of India",
    "source_last_updated": "2026-07-14",
    "verification_date": "2026-09-18",
    "verification_status": "verified"
  },
  {
    "id": "jee-main-physics-rotational-motion-09",
    "exam": "JEE Main",
    "subject": "Physics",
    "chapter": "Rotational Motion",
    "subtopic": "Radius of gyration",
    "subtopic_segmentation": "derived_by_contributor",
    "prerequisite_concepts": ["Moment of inertia"],
    "in_syllabus": true,
    "source_url": "https://cdnbbsr.s3waas.gov.in/s3f8e59f4b2fe7c5705bf878bbd494ccdf/uploads/2025/10/202510311323551056.pdf",
    "source_landing_page": "https://jeemain.nta.nic.in/document/syllabus-2026/",
    "source_publisher": "National Testing Agency (NTA), Ministry of Education, Government of India",
    "source_last_updated": "2026-07-14",
    "verification_date": "2026-09-18",
    "verification_status": "verified"
  },
  {
    "id": "jee-main-physics-rotational-motion-10",
    "exam": "JEE Main",
    "subject": "Physics",
    "chapter": "Rotational Motion",
    "subtopic": "Values of moment of inertia for simple geometrical objects",
    "subtopic_segmentation": "derived_by_contributor",
    "prerequisite_concepts": ["Moment of inertia"],
    "in_syllabus": true,
    "source_url": "https://cdnbbsr.s3waas.gov.in/s3f8e59f4b2fe7c5705bf878bbd494ccdf/uploads/2025/10/202510311323551056.pdf",
    "source_landing_page": "https://jeemain.nta.nic.in/document/syllabus-2026/",
    "source_publisher": "National Testing Agency (NTA), Ministry of Education, Government of India",
    "source_last_updated": "2026-07-14",
    "verification_date": "2026-09-18",
    "verification_status": "verified"
  },
  {
    "id": "jee-main-physics-rotational-motion-11",
    "exam": "JEE Main",
    "subject": "Physics",
    "chapter": "Rotational Motion",
    "subtopic": "Parallel axes theorem",
    "subtopic_segmentation": "derived_by_contributor",
    "prerequisite_concepts": ["Moment of inertia"],
    "in_syllabus": true,
    "source_url": "https://cdnbbsr.s3waas.gov.in/s3f8e59f4b2fe7c5705bf878bbd494ccdf/uploads/2025/10/202510311323551056.pdf",
    "source_landing_page": "https://jeemain.nta.nic.in/document/syllabus-2026/",
    "source_publisher": "National Testing Agency (NTA), Ministry of Education, Government of India",
    "source_last_updated": "2026-07-14",
    "verification_date": "2026-09-18",
    "verification_status": "verified"
  },
  {
    "id": "jee-main-physics-rotational-motion-12",
    "exam": "JEE Main",
    "subject": "Physics",
    "chapter": "Rotational Motion",
    "subtopic": "Perpendicular axes theorem",
    "subtopic_segmentation": "derived_by_contributor",
    "prerequisite_concepts": ["Moment of inertia"],
    "in_syllabus": true,
    "source_url": "https://cdnbbsr.s3waas.gov.in/s3f8e59f4b2fe7c5705bf878bbd494ccdf/uploads/2025/10/202510311323551056.pdf",
    "source_landing_page": "https://jeemain.nta.nic.in/document/syllabus-2026/",
    "source_publisher": "National Testing Agency (NTA), Ministry of Education, Government of India",
    "source_last_updated": "2026-07-14",
    "verification_date": "2026-09-18",
    "verification_status": "verified"
  },
  {
    "id": "jee-main-physics-rotational-motion-13",
    "exam": "JEE Main",
    "subject": "Physics",
    "chapter": "Rotational Motion",
    "subtopic": "Equilibrium of rigid bodies",
    "subtopic_segmentation": "derived_by_contributor",
    "prerequisite_concepts": ["Torque"],
    "in_syllabus": true,
    "source_url": "https://cdnbbsr.s3waas.gov.in/s3f8e59f4b2fe7c5705bf878bbd494ccdf/uploads/2025/10/202510311323551056.pdf",
    "source_landing_page": "https://jeemain.nta.nic.in/document/syllabus-2026/",
    "source_publisher": "National Testing Agency (NTA), Ministry of Education, Government of India",
    "source_last_updated": "2026-07-14",
    "verification_date": "2026-09-18",
    "verification_status": "verified"
  },
  {
    "id": "jee-main-physics-rotational-motion-14",
    "exam": "JEE Main",
    "subject": "Physics",
    "chapter": "Rotational Motion",
    "subtopic": "Rigid body rotation and equations of rotational motion",
    "subtopic_segmentation": "derived_by_contributor",
    "prerequisite_concepts": ["Basic concepts of rotational motion"],